<?xml version="1.0" encoding="UTF-8"?>
<doctrine-mapping xmlns="http://doctrine-project.org/schemas/phpcr-odm/phpcr-mapping"
                  xmlns:xsi="http://www.w3.org/2001/XMLSchema-instance"
                  xsi:schemaLocation="http://doctrine-project.org/schemas/phpcr-odm/phpcr-mapping
                  https://github.com/doctrine/phpcr-odm/raw/master/doctrine-phpcr-odm-mapping.xsd">
    <document name="Doctrine\Tests\ODM\PHPCR\Mapping\Model\PropertyMappingObject">
        <id name="id" />
        <field name="string" type="string" />
        <field name="binary" type="binary" />
        <field name="long" type="long" />
        <field name="int" type="int" />
        <field name="decimal" type="decimal" />
        <field name="double" type="double" />
        <field name="float" type="float" />
        <field name="date" type="date" />
        <field name="boolean" type="boolean" />
        <field name="name" type="name" />
        <field name="path" type="path" />
        <field name="uri" type="uri" />
    </document>
</doctrine-mapping>
